page,text,left,top,width,height,line
14,another country or territory sign a formal agreement on behalf of their communities endorsing a,0.117647,0.243636,0.761961,0.013636,10
14,"""sister city/sister cities"" relationship. Sister city agreements shall be considered active/valid",0.118039,0.259697,0.731373,0.013939,11
14,unless otherwise indicated by one or both of the respective communities.,0.118039,0.276061,0.58549,0.013636,12
14,Sister Cities International shall formally recognize only those relationships by cities/members in,0.118039,0.299697,0.758824,0.013636,13
14,good standing (i.e. who are current on membership dues) in its Membership Directory or on its,0.117647,0.316061,0.754902,0.013636,14
14,"website. However, Sister Cities International shall not assert as invalid or otherwise impugn the",0.116863,0.332121,0.760784,0.013636,15
14,legitimacy of those relationships formed by non-members.,0.118039,0.348485,0.466275,0.013636,16
14,Friendship City,0.118039,0.372121,0.127059,0.013939,17
14,"A Friendship City or Friendship Cities relationship is often formed by cities as a ""stepping",0.117255,0.395758,0.714118,0.013636,18
14,"stone"" to a more formal ""Sister City"" agreement. Typically Friendship City agreements are",0.117647,0.411515,0.720392,0.014242,19
14,referred to as such in the formal documents that are signed. Sister Cities International shall,0.118039,0.428182,0.72549,0.013636,20
14,recognize Friendship City relationships by members in its Membership Directory and website.,0.118039,0.444242,0.747843,0.013636,21
14,As per Sister Cities International Board of Directors:,0.117255,0.467879,0.413333,0.013636,22
14,Sister Cities International will recognize a new sister cities affiliation between a,0.169412,0.492121,0.626667,0.013333,23
14,"U.S. and an international community, even though another affiliation may exist",0.169412,0.507879,0.625098,0.013636,24
14,"between that international community and a different U.S. community, only if a",0.169412,0.524545,0.62902,0.013636,25
14,cooperative agreement among all involved communities is filed with Sister Cities,0.16902,0.540606,0.643137,0.013636,26
14,"International. If a cooperative agreement is denied, or no response to the request",0.170196,0.556667,0.647843,0.013333,27
14,"is received within a reasonable amount of time, Sister Cities International will",0.169412,0.57303,0.612157,0.012727,28
14,recognize the partnership as a friendship city and it will be delineated as such,0.169412,0.589091,0.621176,0.013636,29
14,with a symbol in the membership directories.,0.168627,0.605455,0.358824,0.013333,30
14,The cooperative agreement must be sent by the Mayor/County,0.168627,0.628788,0.509412,0.013939,31
14,"Executive/Governor of the requesting community, and must be sent to the",0.169804,0.645152,0.595294,0.014242,32
14,Mayor/County Executive/Governor of each of the existing partnership,0.169804,0.661212,0.555294,0.013636,33
14,communities. Although the Mayor/County Executive/Governor may request input,0.16902,0.677879,0.647451,0.013636,34
14,"from, or may be given input by, the sister cities program, it is up to the discretion",0.168627,0.693939,0.647059,0.013939,35
14,of the Mayor/County Executive/Governor to sign the cooperative agreement.,0.16902,0.709697,0.612941,0.013939,36
14,Although Sister Cities International will help with the cooperative agreement,0.168627,0.726364,0.605882,0.013636,37
14,"process, it is up to the requesting community to get the agreement signed. Sister",0.169412,0.742121,0.650196,0.013939,38
14,"Cities International will not, in any way, force a community to ""share"" and sign",0.16902,0.758182,0.623922,0.014242,39
14,the cooperative agreement.,0.168627,0.774848,0.219216,0.013333,40
14,"To place a relationship into Emeritus status, the mayor or highest elected official of the U.S.",0.117255,0.798485,0.736471,0.013939,41
14,community must write a letter to the mayor of the foreign city indicating that they wish to,0.118039,0.814545,0.70902,0.013636,42
14,"remain sister cities, but understand that the relationship will remain inactive until such time as",0.118039,0.831212,0.747451,0.013333,43
14,both cities are able to sustain an active relationship. Sister Cities International should be,0.118039,0.847273,0.705098,0.013636,44
14,informed in writing by the mayor of the U.S. city of the situation. Sister Cities International will,0.118039,0.863333,0.746275,0.013636,45
15,SisterCities,0.169804,0.033333,0.238824,0.028182,1
15,Partnership Agreement,0.516078,0.027879,0.440784,0.032424,2
15,INTERNATIONAL,0.170196,0.06697,0.237647,0.008788,3
15,Connect globally. Thrive locally.,0.169804,0.08697,0.239216,0.01303,4
15,Toolkit,0.83098,0.072727,0.127059,0.025455,5
15,then place the partnership into Emeritus Status and will reflect this status in directories and all,0.117255,0.132424,0.751373,0.013333,6
15,lists of sister city programs.,0.118039,0.148788,0.218431,0.013333,7
15,"If a community wishes to terminate a sister city relationship, then a letter from the mayor or",0.118431,0.172424,0.732549,0.013333,8
15,highest elected official of the U.S. city should be sent to the mayor of the sister city. Sister,0.118039,0.188485,0.721569,0.013636,9
15,Cities International should be informed of this action in writing by the mayor of the U.S. city,0.118039,0.204848,0.72902,0.013333,10
15,and Sister Cities International will then remove the partnership from its directories and all lists,0.117647,0.221212,0.746275,0.013333,11
15,of sister city programs. We do not recommend terminating a relationship simply because it is,0.117647,0.237273,0.743529,0.013333,12
15,"dormant. Many partnerships wax and wane over the years, and in many cases a dormant",0.117647,0.253939,0.713333,0.013333,13
15,partnership may be reinvigorated by local members years after it has been inactive.,0.118039,0.269697,0.664314,0.013636,14
15,General Guidelines,0.118039,0.295152,0.231765,0.016061,15
15,In order for a sister city/county/state partnership to be recognized by Sister Cities International,0.118431,0.324242,0.754902,0.013636,16
15,"(SCI), the two communities must sign formal documents which clearly endorse the link. This",0.118039,0.340606,0.74,0.013636,17
15,presumes several key items: that the U.S. community is already a member of SCI and has,0.118039,0.35697,0.718039,0.013636,18
15,followed proper procedures (e.g. passed a city council resolution declaring the intent to twin,0.117255,0.373333,0.737647,0.013636,19
15,with the specific city); that both communities share a mutual commitment to the relationship;,0.117255,0.389394,0.740784,0.013636,20
15,and that both have secured the necessary support structure to build a lasting relationship. You,0.117647,0.405455,0.758039,0.013333,21
15,should check with your local sister city program to see if they have any additional requirements,0.117647,0.421818,0.760784,0.013636,22
15,before pursuing a sister city relationship.,0.118039,0.437879,0.323137,0.013636,23
15,"SCI often refers to these agreements as a ""Sister City Agreement"" or ""Memorandum of",0.118039,0.461515,0.696863,0.013939,24
15,"Understanding."" However, as the following examples show, the actual name and format of",0.118039,0.477576,0.729804,0.013636,25
15,your documents is left up to you.,0.117255,0.494242,0.262745,0.013636,26
15,A few things to keep in mind as you draft your agreement:,0.117255,0.517879,0.463137,0.013636,27
15,"Your agreement can range from the ceremonial, with language focusing on each city's",0.176471,0.542121,0.69098,0.013939,28
15,"commitment to fostering understanding, cooperation, and mutual benefit to the precise,",0.176471,0.558485,0.701961,0.013333,29
15,"with particular areas of interest, specific programs/activities, or more concrete goals",0.176078,0.574848,0.673725,0.013636,30
15,related to anything from numbers of exchanges to economic development.,0.176863,0.591212,0.596863,0.013636,31
15,"Don't try to include everything you plan to do. Some specifics, like particular areas of",0.177255,0.620303,0.681176,0.013939,32
15,"interest or participating institutions are good to include. However, there's no need to",0.176471,0.636667,0.675686,0.013636,33
15,include all the programs you plan to do if it makes the document too lengthy or limits,0.176863,0.652727,0.678824,0.013939,34
15,the scope of projects. This is a formal document to establish the relationship; specific,0.176078,0.668788,0.684706,0.013636,35
15,"tasks, responsibilities, or other nuts-and-bolts text related to implementation or",0.176078,0.685455,0.635686,0.013333,36
15,administration of the partnership can be expressed more fully in a separate,0.176471,0.701212,0.600392,0.013636,37
15,memorandum between the respective sister city committees. Your partnership,0.177255,0.717576,0.626667,0.013636,38
15,agreement is a historical document and should not be dated or limited by being aligned,0.176471,0.733636,0.699216,0.013636,39
15,with very specific tasks.,0.176078,0.750606,0.190196,0.013333,40
15,Work with your counterparts. Remember that this is signed by both cities. You should,0.176078,0.779697,0.68549,0.013636,41
15,share drafts of your agreement with your international partners and solicit feedback on,0.176471,0.795758,0.691765,0.013333,42
15,what they'd like to see in the agreement. Be flexible to cultural or municipal priorities.,0.176471,0.811818,0.679216,0.013939,43
15,Ask your counterparts to translate the agreement if it is drafted in English. It is,0.176078,0.841515,0.623137,0.013636,44
15,important for the citizens of your partner community to be able to read and understand,0.176863,0.857576,0.693725,0.013939,45
15,the commitment their city has made. Have someone in your own community who,0.176078,0.873939,0.649804,0.013636,46
16,SisterCities,0.169804,0.033333,0.239216,0.028182,1
16,Partnership Agreement,0.516078,0.027879,0.441176,0.032121,2
16,INTERNATIONAL,0.170196,0.06697,0.237255,0.008788,3
16,Connect globally. Thrive locally.,0.169804,0.08697,0.239216,0.01303,4
16,Toolkit,0.83098,0.07303,0.126667,0.025152,5
16,speaks that language check the foreign-language version to make sure it mirrors what,0.176471,0.132424,0.688235,0.013333,6
16,you have in your own agreement.,0.176471,0.148788,0.264706,0.013333,7
16,Keep it to one page. Ceremonial documents such as these partnership agreements,0.176863,0.178485,0.66549,0.013636,8
16,work best if they can be posted in their entirety.,0.176078,0.194545,0.380392,0.013636,9
16,Most sister city agreements include some acknowledgement of the founding principles,0.177255,0.224242,0.694902,0.013636,10
16,"of the sister city movement- to promote peace through mutual respect, understanding,",0.176471,0.240303,0.698431,0.013333,11
16,and cooperation.,0.176471,0.25697,0.13451,0.013333,12
16,Consider using official letterhead and/or other embellishments such as city seals or,0.176863,0.286061,0.665882,0.013333,13
16,logos to reflect your enhance the document. Sister city agreements are often posted at,0.176863,0.302121,0.695686,0.013636,14
16,city hall or other municipal offices and should reflect their historical importance,0.176471,0.318485,0.630588,0.013333,15
16,Look at other agreements your city has signed. These agreements may give you an idea,0.177255,0.347879,0.705098,0.013636,16
16,"of what is acceptable or possible, and they may be in an easily replicable format. If you",0.176471,0.364242,0.695686,0.013636,17
16,"cannot access older agreements please contact Sister Cities International, we may",0.176863,0.380303,0.663137,0.013636,18
16,"have them on file, although we do not have copies of all partnership agreements.",0.176863,0.396667,0.64549,0.013636,19
16,Documents must be signed by the top elected official of both communities.,0.177255,0.426364,0.601569,0.013333,20
16,"Check with your mayor, city council, town clerk, et al. to make sure that the agreement",0.176863,0.455758,0.694118,0.013636,21
16,"is OK with them. The mayor is the one putting his or her name on the paper, and you",0.176863,0.471818,0.677255,0.013333,22
16,don't want to spend time developing an agreement which will never be signed.,0.176863,0.488182,0.629412,0.013636,23
16,Official documents are usually signed during a formal ceremony recognizing the,0.176863,0.517576,0.638431,0.013636,24
16,partnership. Be sure both communities receive a signed set of the official documents,0.177255,0.533939,0.683922,0.013636,25
16,for their records.,0.176078,0.550606,0.131373,0.010606,26
16,Remember to send your signed agreement to Sister Cities International. After we,0.177255,0.579697,0.645098,0.013636,27
16,receive your agreement we will post the relationship in the City Directory and make sure,0.176863,0.595758,0.703137,0.013636,28
16,it is included in our Annual Membership Directory.,0.176863,0.612121,0.398039,0.013333,29
16,Remember that each city's sister city program is independent and can impose requirements,0.118431,0.640606,0.736471,0.013939,30
16,"like the establishment of a committee, a review period, sustainability/funding plan, among",0.118039,0.65697,0.715686,0.013636,31
16,"others, before sanctioning a sister city agreement. Check with your local program or mayor's",0.117647,0.672727,0.743529,0.014242,32
16,office to see if this is the case.,0.117647,0.689091,0.241176,0.011515,33
16,On the following pages you'll find a series of partnership agreements to give you an idea of,0.118039,0.717879,0.728627,0.013939,34
16,"what is possible. While you should feel free to use some of the formatting and language, we",0.117255,0.734242,0.73451,0.013636,35
16,encourage you to make your agreement your own and be creative with what you produce. If,0.117647,0.750606,0.737647,0.013636,36
16,you are unsure about your agreement or want advice you can always solicit feedback by,0.117647,0.766667,0.708627,0.013636,37
16,sending it to our Membership Director at akaplan@sister-cities.org or contacting us at (202),0.117647,0.782727,0.732157,0.013636,38
16,347-8630.,0.117647,0.799394,0.080392,0.010303,39
17,SisterCities,0.169412,0.033333,0.239608,0.028485,1
17,Partnership Agreement,0.516471,0.027879,0.440784,0.032727,2
17,INTERNATIONAL,0.170196,0.066667,0.238431,0.009091,3
17,Connect globally. Thrive locally.,0.169412,0.08697,0.239608,0.013333,4
17,Toolkit,0.830588,0.072727,0.127843,0.025758,5
17,"jull bubzig 2000 3,312",0.378039,0.291212,0.32549,0.019394,6
17,ABU DHABI MUNICIPALITY & TOWN PLANNING,0.376471,0.316667,0.327451,0.016667,7
17,AN AGREEMENT FOR THE ESTABLISHMENT OF,0.260784,0.373636,0.52549,0.012727,8
17,SISTER CITIES RELATIONSHIP,0.337647,0.393636,0.342745,0.012121,9
17,BETWEEN,0.454902,0.413636,0.110588,0.011212,10
17,THE CITY OF ABU DHABI ( U. A.E),0.337255,0.432727,0.375686,0.013939,11
17,AND,0.487843,0.452727,0.048235,0.011212,12
17,"HOUSTON, TEXAS ( U.S.A)",0.385882,0.471515,0.298039,0.014848,13
17,"The Sister City Program, administered by Sister Cities International, was initiated",0.221961,0.525455,0.597255,0.01303,14
17,By the President of the United States of America in 1956 to encourage greater,0.222745,0.539394,0.561961,0.012727,15
17,Friendship and understanding between the United States and other nations through,0.222745,0.553333,0.608235,0.012727,16
17,Direct personal contact: and,0.222745,0.567576,0.20549,0.012424,17
17,"In order to foster those goals, the people of Abu Dhabi and Houston, in a gesture of",0.222353,0.594242,0.603529,0.012424,18
17,"Friendship and goodwill, agree to collaborate for the mutual benefit of their",0.222745,0.608182,0.547843,0.01303,19
17,"Communities by exploring education, economic and cultural opportunities.",0.222353,0.622121,0.541961,0.012121,20
17,"Abu Dhabi and Houston, sharing a common interest in energy, technology and",0.221569,0.648788,0.574118,0.012424,21
17,"medicine, and the desire to promote mutual understanding among our citizens do",0.222353,0.66303,0.588235,0.012121,22
17,"hereby proclaim themselves Sister Cities beginning on the 13th day of March 2001,",0.221961,0.673636,0.594118,0.015758,23
17,the date of Houston City Council resolution estatblishing the Sister City,0.221961,0.690303,0.519608,0.01303,24
17,relationship became effective.,0.221569,0.705152,0.217647,0.012424,25
17,"Signed on this 26 of October 2002, in duplicate in the Arabic and English",0.221569,0.732121,0.533333,0.01303,26
17,"Languages, both text being equally authentic.",0.221961,0.746667,0.328627,0.012727,27
17,A,0.344314,0.768485,0.084706,0.030303,28
17,Sheikh Mohammed bin Butti AI Hamed,0.245882,0.806364,0.366275,0.010909,29
17,Lee P.Brown,0.729412,0.806364,0.118824,0.010303,30
17,Chairman of Abu Dhabi Municipality,0.24549,0.823636,0.342353,0.012727,31
17,Mayor of Houston,0.704706,0.823333,0.166667,0.012424,32
17,&Town Planning,0.324314,0.841212,0.155686,0.012424,33
18,SisterCities,0.169412,0.033333,0.239608,0.028485,1
18,Partnership Agreement,0.516078,0.027879,0.441176,0.032424,2
18,INTERNATIONAL,0.17098,0.066667,0.237255,0.009091,3
18,Connect globally. Thrive locally.,0.169412,0.08697,0.239216,0.013333,4
18,Toolkit,0.83098,0.072727,0.127059,0.025758,5
18,THE CITY OF NEW YORK,0.438824,0.262121,0.240784,0.009697,6
18,OFFICE OF THE MAYOR,0.450196,0.27697,0.220392,0.009697,7
18,"NEW YORK, N.Y. 10007",0.461176,0.29303,0.196863,0.010303,8
18,THE NEW YORK CITY-LONDON SISTER CITY PARTNERSHIP,0.267451,0.355758,0.582745,0.011818,9
18,Memorandum of Understanding,0.420392,0.371212,0.274902,0.013333,10
18,The Sister City partnership between New York City and London will foster mutually,0.201176,0.402121,0.674118,0.014242,11
18,beneficial solutions to common challenges for these two great cosmopolitan entities.,0.201176,0.417273,0.66902,0.013636,12
18,"Consequently, the Sister City relationship between the two will be one of the most",0.201176,0.432727,0.652549,0.015152,13
18,"important in their network of global partnerships, as it strives to:",0.201176,0.448182,0.50902,0.015455,14
18,Encourage and publicize existing exchanges between London and New York City so,0.230588,0.480303,0.671373,0.015152,15
18,that they can flourish to benefit a wider cross-section of the citizens of both;,0.230588,0.496061,0.602353,0.015152,16
18,"Support and promote the development of new social, economic, academic and",0.230196,0.512424,0.618431,0.015455,17
18,community programs to encourage both cities' citizens to share their experiences as a,0.229804,0.527879,0.678039,0.014848,18
18,medium for learning from one another;,0.229804,0.543636,0.309412,0.013939,19
18,Generate an improvement of the operation of the cities' various government agencies,0.229804,0.56,0.676078,0.014545,20
18,by serving as a conduit of information;,0.22902,0.575758,0.307843,0.014848,21
18,"Identify themes, common to both, that can generate new initiatives to further and",0.229412,0.591818,0.640784,0.015152,22
18,"nurture the increasingly powerful financial, social and cultural relationships between",0.22902,0.607576,0.671373,0.014242,23
18,the cities;,0.22902,0.624545,0.076471,0.012424,24
18,Promote key mayoral priorities relevant to both London and New York City;,0.228627,0.639394,0.608627,0.015152,25
18,Provide financial or in kind support to community-led programs that advance the,0.228627,0.656061,0.641569,0.013636,26
18,aims of the Sister City partnership;,0.22902,0.672121,0.275294,0.013636,27
18,"With the above purposes in mind, the Mayor of the City of New York and the Mayor of",0.198824,0.702424,0.697647,0.014848,28
18,London solemnly confirm that these two cities are united by an official partnership by the,0.198824,0.718182,0.710196,0.014545,29
18,protocol of this Memorandum of Understanding.,0.198431,0.733939,0.384314,0.015152,30
18,This agreement will go into effect from the date of signatures.,0.310196,0.780606,0.488235,0.014545,31
18,Signed in March of 2001,0.455686,0.796364,0.19451,0.013636,32
18,Thedder Rudolph W. Giuliani,0.178824,0.795455,0.244314,0.100909,33
18,Mayor,0.311373,0.894848,0.053333,0.012727,34
18,Ken Mayor Livingstone,0.672157,0.877576,0.132941,0.029091,35
18,New York City,0.287843,0.909091,0.121176,0.013333,36
18,London,0.701961,0.909091,0.061569,0.010606,37
19,SisterCities,0.169412,0.03303,0.24,0.028182,1
19,Partnership Agreement,0.515686,0.027576,0.441961,0.03303,2
19,INTERNATIONAL,0.169804,0.066667,0.238431,0.009091,3
19,Connect globally. Thrive locally.,0.169412,0.08697,0.239608,0.013333,4
19,Toolkit,0.83098,0.072727,0.127451,0.025758,5
19,CHIC OF STATE,0.247451,0.190606,0.141961,0.036364,6
19,City of Long Beach,0.388627,0.196667,0.476471,0.066364,7
19,California,0.551373,0.257273,0.136471,0.033333,8
19,Sister City Agreement,0.321961,0.305455,0.378431,0.035152,9
19,between the,0.464706,0.352727,0.084314,0.009697,10
19,City of Long Beach,0.38,0.378485,0.252549,0.01697,11
19,"California, USA",0.4,0.397576,0.21098,0.016061,12
19,and the,0.48,0.415152,0.053333,0.009091,13
19,City of San Pablo de Manta,0.321569,0.428788,0.369804,0.01697,14
19,"Ecuador, South America",0.347451,0.447879,0.317255,0.015152,15
19,"In accordance with the authorization and approval expressed by the City of Long Beach,",0.261569,0.482121,0.536863,0.012121,16
19,"California, USA, and the City of San Pablo de Manta, Ecundor, South America, it is declared",0.217647,0.492727,0.581176,0.01303,17
19,"that a ""Sister City Agreement between the two cities is hereby established for the following",0.217647,0.502727,0.581569,0.012121,18
19,purposes:,0.216863,0.516061,0.058039,0.009394,19
19,(1) to promote and expand the effective and mutually beneficial cooperation between,0.278824,0.532727,0.520392,0.012424,20
19,the people of Long Beach and the people of San Pablo de Manta; and,0.218039,0.543636,0.40549,0.012424,21
19,"(2) to promote international goodwill, understanding, and expanded business",0.279216,0.56303,0.520784,0.012424,22
19,"relations between the two cities and their respective nations by the exchange of people, ideas, and",0.218039,0.573636,0.581569,0.012121,23
19,"information in a unide variety of economic, social, cultural, municipal, environmental,",0.218039,0.584242,0.581176,0.012121,24
19,"professional, technical, youth, and other endeavors; and",0.217647,0.594848,0.333333,0.012121,25
19,"(3) to foster and encourage charitable, scientific, trade and commerce, literary and",0.279608,0.613939,0.520784,0.012727,26
19,educational activities between the two cities;,0.218039,0.625455,0.265882,0.009697,27
19,This Sister City Agreement shall be officially established and shall become effective when,0.263137,0.644545,0.536863,0.012727,28
19,"this document has been duly executed by the Mayor of Long Beach, California, USA, and the",0.218824,0.654848,0.581961,0.012424,29
19,"Mayor of San Pablo de Manta, Ecundor, South America.",0.218431,0.665758,0.338824,0.012121,30
19,STATE OFFICE,0.276471,0.713636,0.050588,0.048788,31
19,Beverly 0 Neill,0.587451,0.736667,0.121961,0.013636,32
19,"Mayor, City of Long Beach",0.542353,0.751212,0.21098,0.013636,33
19,"California, USA",0.582745,0.765758,0.125098,0.01303,34
19,10.2aulus,0.490588,0.771818,0.220392,0.062424,35
19,Ing. Jorge O. Zambrano Cedeño,0.527059,0.825152,0.242745,0.013333,36
19,"Mayor, City of San Pablo de Manta",0.505098,0.839394,0.277647,0.013636,37
19,"Ecuador, South America",0.551765,0.854242,0.188235,0.011818,38
19,"Dated: September 19, 2000",0.544706,0.883333,0.202745,0.01303,39
20,SisterCities,0.169412,0.03303,0.24,0.028485,1
20,Partnership Agreement,0.516078,0.027879,0.441176,0.032424,2
20,INTERNATIONAL,0.170196,0.066667,0.237647,0.009091,3
20,Connect globally. Thrive locally.,0.169412,0.08697,0.239216,0.013333,4
20,Toolkit,0.83098,0.072727,0.127451,0.025758,5
20,REAFFIRMATION OF SISTER CITIES DECLARATION,0.324706,0.165152,0.483529,0.013939,6
20,adopted by,0.2,0.213333,0.080392,0.013636,7
20,THE HONORABLE RICHARD M. DALEY,0.396078,0.214242,0.335686,0.012424,8
20,MAYOR OF CHICAGO,0.472549,0.231212,0.18549,0.011515,9
20,and,0.199608,0.260909,0.026275,0.010606,10
20,THE HONORABLE ZHANG RONGMAO,0.401961,0.261212,0.323137,0.011212,11
20,MAYOR OF SHENYANG,0.463529,0.273636,0.202353,0.011212,12
20,ON,0.551765,0.298182,0.026667,0.011515,13
20,"JUNE 5, 1995",0.500392,0.323636,0.128235,0.014848,14
20,"On this the tenth anniversary of the signing of a sister city agreement, in order to further",0.255686,0.36303,0.67098,0.015152,15
20,the traditional links of friendship between Chicago and Shenyang and to reaffirm their mutual,0.198824,0.378788,0.727843,0.015455,16
20,"aspiration to work in unison for the benefit of their cities and nations, the Honorable Mayor",0.199608,0.394848,0.727843,0.014848,17
20,"Richard M. Daley, Mayor of the City of Chicago, and the Honorable Zhang Rongmao, Mayor",0.199216,0.411212,0.727451,0.014242,18
20,"of the City of Shenyang, on this fifth day of June 1995, do hereby acknowledge and reaffirm the",0.199216,0.42697,0.72549,0.014848,19
20,sister cities agreement between the City of Chicago and the City of Shenyang.,0.199608,0.443636,0.57451,0.014242,20
20,"The City of Chicago and the City of Shenyang on the basis of friendly cooperation,",0.256078,0.473939,0.665098,0.015152,21
20,equality and mutual benefit will continue to develop a sister cities relationship to promote and,0.2,0.490303,0.724706,0.014242,22
20,broaden economic cooperation and cultural exchanges between the two cities.,0.199216,0.506061,0.57451,0.014242,23
20,The two cities do hereby declare their interest in exploring the establishment of business,0.255294,0.537273,0.668235,0.015455,24
20,and trade relations between Chicago and Shenyang.,0.198824,0.554545,0.387843,0.013636,25
20,"In addition, exchanges will be promoted in the area of the arts such as exhibits, music,",0.254118,0.583939,0.666667,0.015455,26
20,dance and other cultural activities.,0.198431,0.601212,0.256471,0.010606,27
20,"In addition, exchanges will be promoted in education and the establishment of contacts",0.254118,0.630303,0.668627,0.015758,28
20,within educational institutions encouraged.,0.198824,0.647273,0.32,0.014242,29
