page,text,left,top,width,height,line
1,5-Point Networking Email,0.404314,0.050606,0.189804,0.012121,1
1,"Steve Dalton, the author of The 2-Hour Job Search believes the perfect networking email is a ""5-Point E-mail"". The five",0.058824,0.086061,0.859608,0.012727,2
1,points are as follows:,0.059216,0.10303,0.152941,0.012727,3
1,1. 100 words or less,0.088627,0.136667,0.156078,0.010303,4
1,2. No mention of jobs (in subject or body),0.088235,0.153333,0.31451,0.012727,5
1,"3. Connection goes first (e.g., ND connection)",0.087843,0.170606,0.341569,0.01303,6
1,4. Generalize your interest,0.087843,0.187879,0.205098,0.012424,7
1,5. Maintain control of the follow up,0.088627,0.204545,0.27098,0.012727,8
1,Here's an example of what a 5-Point email would look like:,0.059608,0.255455,0.42549,0.012727,9
1,Subject: Notre Dame MBA Student Seeking Your Advice,0.117255,0.289394,0.414118,0.012424,10
1,"Dear Mr. Jones,",0.118039,0.323939,0.112549,0.011515,11
1,"My name is Brooke Franklin, and I'm a first-year Notre Dame MBA student who found your",0.118431,0.35697,0.661569,0.01303,12
1,information in the ND alumni database. May I have 15 minutes of your time to ask you about,0.118039,0.374242,0.677255,0.012727,13
1,your experience with IBM? I'm trying to learn more about marketing careers at technology,0.117255,0.391212,0.660784,0.01303,14
1,companies and your insights would be very helpful.,0.117647,0.407879,0.373333,0.01303,15
1,"I realize this may be a busy time for you, so if we're unable to connect this week, I'll try again",0.118039,0.442121,0.674902,0.012727,16
1,next week to see whether that is more convenient.,0.118039,0.459091,0.370588,0.010303,17
1,"Thank you for your time,",0.117255,0.492727,0.179216,0.012727,18
1,Brooke,0.118431,0.51,0.050588,0.01,19
1,The most important part of this email may be the follow-up; an email like this allows you to reach out again in a week if,0.058431,0.543333,0.872157,0.01303,20
1,you haven't heard back without feeling like you're bothering the person at the other end. If you don't hear anything,0.058431,0.560606,0.843922,0.01303,21
1,"after the second attempt, you can probably cross him/her off your list and move on to the next contact.",0.058824,0.577273,0.755686,0.01303,22
2,36 Westmoreland Drive,0.705764,0.026796,0.209996,0.011403,1
2,Newcastle upon Tyne,0.723499,0.04333,0.192664,0.013968,2
2,NE1 8LT,0.836759,0.059863,0.079807,0.011117,3
2,Mr Mark Wilson,0.083837,0.076112,0.138251,0.011403,4
2,UK Health Trust,0.083837,0.09236,0.143087,0.011403,5
2,18 Whitehall Square,0.084643,0.108609,0.179766,0.013968,6
2,London,0.083837,0.125428,0.066102,0.011117,7
2,SW1 9LT,0.083837,0.141391,0.083031,0.011403,8
2,11th January 2015,0.755744,0.154789,0.161225,0.017389,9
2,Dear Mr Wilson,0.083837,0.174173,0.137042,0.011403,10
2,Re: Community Health Development Officer [HD/12/2014],0.083837,0.201539,0.544135,0.014253,11
2,"I am writing to apply for the above post, as advertised on the Health UK recruitment site. I am",0.08424,0.228905,0.828295,0.014253,12
2,a sociology graduate with a 2: 1from Newcastle University. I have relevant health awareness,0.083434,0.245439,0.822249,0.014253,13
2,"experience, and I am looking for a position where I can employ my knowledge and skills in",0.083434,0.261973,0.802499,0.013968,14
2,support of health and community development. I enclose my CV for your attention.,0.083434,0.277936,0.731963,0.014253,15
2,I am eager to work for UK Health Trust because of your ground-breaking work within the field,0.08424,0.305302,0.825877,0.014253,16
2,of community health. I became aware of the work of the Trust when carrying out my,0.083434,0.322121,0.744055,0.013968,17
2,"dissertation, 'Generational Change in Local Health Awareness, where I researched health",0.083031,0.338084,0.798468,0.014253,18
2,awareness of children and elderly people in a deprived location. I referred to a number of,0.083031,0.354618,0.792019,0.013968,19
2,publications produced by UK Health Trust and was impressed by the innovative techniques,0.083837,0.371152,0.809351,0.013968,20
2,your organisation uses to engage local community members in projects. The Community,0.083031,0.387685,0.788795,0.014253,21
2,Health Development Officer position would further develop my existing abilities and my,0.08424,0.403934,0.771463,0.014253,22
2,"understanding of community development, allowing me to contribute in a practical way to",0.083837,0.420468,0.789601,0.013968,23
2,enhancing the health of disadvantaged people.,0.083434,0.436716,0.415961,0.013968,24
2,The volunteer development aspect of the position particularly appeals to me. I have worked,0.083031,0.469213,0.811769,0.014538,25
2,"in the voluntary sector, providing services tackling health inequalities and promoting healthy",0.083837,0.485747,0.814994,0.014253,26
2,living in Newcastle. I promoted health awareness through one to one sessions and in large,0.083434,0.501995,0.805723,0.014253,27
2,"groups and developed interpersonal skills, confidence and patience when engaging and",0.083031,0.518529,0.787183,0.014253,28
2,"motivating participants. While raising the group's profile using social media, the local press",0.083434,0.534778,0.804917,0.013968,29
2,"and at presentations to youth clubs, faith meetings and care homes I recognised the need to",0.083434,0.551596,0.820637,0.013968,30
2,"change my delivery style to suit the audience. As a volunteer teacher in Ghana, I developed",0.083434,0.56756,0.8158,0.014253,31
2,communication and team-building skills essential to your advertised role; liaising with,0.083434,0.584094,0.753325,0.013968,32
2,colleagues and parents and a lively group of twenty-five 7-8 year olds to arrange a,0.083434,0.600627,0.731963,0.014253,33
2,"community event. My retail experience, coupled with my extracurricular activities additionally",0.083434,0.617161,0.822249,0.013968,34
2,"enhanced my ability to develop others, as I was responsible for inducting and training my",0.083434,0.633409,0.79081,0.014253,35
2,peers.,0.083837,0.652509,0.05401,0.011117,36
2,"In relation to the fundraising and budgeting aspect of the role, I have experience of raising",0.08424,0.68244,0.798065,0.014253,37
2,"substantial amounts of money through several successful charity events, including a well -",0.083031,0.698404,0.802096,0.014538,38
2,attended fashion show. I was also elected Treasurer of NU Sociology Society with,0.083434,0.715222,0.728335,0.014253,39
2,responsibility for managing a budget of £3000.,0.083434,0.731471,0.411528,0.014538,40
2,The necessity to travel to identify community issues only adds to the appeal of the position. I,0.083031,0.758837,0.82104,0.014253,41
2,"enjoy driving, hold a full clean driving licence and I am very interested in relocating to London",0.083434,0.775086,0.828295,0.014538,42
2,to work for UK Health Trust.,0.083031,0.791619,0.247481,0.011688,43
2,Thank you for considering my application. I look forward to hearing from you.,0.083434,0.824401,0.68158,0.014253,44
2,Yours sincerely,0.082628,0.857184,0.138251,0.014253,45
2,Rachel Sullivan,0.083837,0.889966,0.137042,0.011403,46
3,SisterCities,0.169804,0.033333,0.238431,0.028182,1
3,Partnership Agreement,0.516078,0.027879,0.440784,0.032424,2
3,INTERNATIONAL,0.170196,0.06697,0.237647,0.008788,3
3,Connect globally. Thrive locally.,0.169804,0.08697,0.238824,0.01303,4
3,Toolkit,0.830588,0.07303,0.126667,0.025152,5
3,Types of Affiliations,0.117255,0.157576,0.241961,0.02,6
3,Sister City Relationship,0.117647,0.187273,0.196863,0.013939,7
3,"A Sister City relationship is formed when the mayor or highest elected official (or, if elections",0.117255,0.211212,0.738824,0.013636,8
3,"do not take place, highest appointed official) from a U.S. community and a community in",0.117647,0.227273,0.70902,0.013939,9
3,another country or territory sign a formal agreement on behalf of their communities endorsing a,0.117647,0.243636,0.761961,0.013636,10
3,"""sister city/sister cities"" relationship. Sister city agreements shall be considered active/valid",0.118039,0.259697,0.731373,0.013939,11
3,unless otherwise indicated by one or both of the respective communities.,0.118039,0.276061,0.58549,0.013636,12
3,Sister Cities International shall formally recognize only those relationships by cities/members in,0.118039,0.299697,0.758824,0.013636,13
3,good standing (i.e. who are current on membership dues) in its Membership Directory or on its,0.117647,0.316061,0.754902,0.013636,14
3,"website. However, Sister Cities International shall not assert as invalid or otherwise impugn the",0.116863,0.332121,0.760784,0.013636,15
3,legitimacy of those relationships formed by non-members.,0.118039,0.348485,0.466275,0.013636,16
3,Friendship City,0.118039,0.372121,0.127059,0.013939,17
3,"A Friendship City or Friendship Cities relationship is often formed by cities as a ""stepping",0.117255,0.395758,0.714118,0.013636,18
3,"stone"" to a more formal ""Sister City"" agreement. Typically Friendship City agreements are",0.117647,0.411515,0.720392,0.014242,19
3,referred to as such in the formal documents that are signed. Sister Cities International shall,0.118039,0.428182,0.72549,0.013636,20
3,recognize Friendship City relationships by members in its Membership Directory and website.,0.118039,0.444242,0.747843,0.013636,21
3,As per Sister Cities International Board of Directors:,0.117255,0.467879,0.413333,0.013636,22
3,Sister Cities International will recognize a new sister cities affiliation between a,0.169412,0.492121,0.626667,0.013333,23
3,"U.S. and an international community, even though another affiliation may exist",0.169412,0.507879,0.625098,0.013636,24
3,"between that international community and a different U.S. community, only if a",0.169412,0.524545,0.62902,0.013636,25
3,cooperative agreement among all involved communities is filed with Sister Cities,0.16902,0.540606,0.643137,0.013636,26
3,"International. If a cooperative agreement is denied, or no response to the request",0.170196,0.556667,0.647843,0.013333,27
3,"is received within a reasonable amount of time, Sister Cities International will",0.169412,0.57303,0.612157,0.012727,28
3,recognize the partnership as a friendship city and it will be delineated as such,0.169412,0.589091,0.621176,0.013636,29
3,with a symbol in the membership directories.,0.168627,0.605455,0.358824,0.013333,30
3,The cooperative agreement must be sent by the Mayor/County,0.168627,0.628788,0.509412,0.013939,31
3,"Executive/Governor of the requesting community, and must be sent to the",0.169804,0.645152,0.595294,0.014242,32
3,Mayor/County Executive/Governor of each of the existing partnership,0.169804,0.661212,0.555294,0.013636,33
3,communities. Although the Mayor/County Executive/Governor may request input,0.16902,0.677879,0.647451,0.013636,34
3,"from, or may be given input by, the sister cities program, it is up to the discretion",0.168627,0.693939,0.647059,0.013939,35
3,of the Mayor/County Executive/Governor to sign the cooperative agreement.,0.16902,0.709697,0.612941,0.013939,36
3,Although Sister Cities International will help with the cooperative agreement,0.168627,0.726364,0.605882,0.013636,37
3,"process, it is up to the requesting community to get the agreement signed. Sister",0.169412,0.742121,0.650196,0.013939,38
3,"Cities International will not, in any way, force a community to ""share"" and sign",0.16902,0.758182,0.623922,0.014242,39
3,the cooperative agreement.,0.168627,0.774848,0.219216,0.013333,40
3,"To place a relationship into Emeritus status, the mayor or highest elected official of the U.S.",0.117255,0.798485,0.736471,0.013939,41
3,community must write a letter to the mayor of the foreign city indicating that they wish to,0.118039,0.814545,0.70902,0.013636,42
3,"remain sister cities, but understand that the relationship will remain inactive until such time as",0.118039,0.831212,0.747451,0.013333,43
3,both cities are able to sustain an active relationship. Sister Cities International should be,0.118039,0.847273,0.705098,0.013636,44
3,informed in writing by the mayor of the U.S. city of the situation. Sister Cities International will,0.118039,0.863333,0.746275,0.013636,45
4,SisterCities,0.169804,0.033333,0.238824,0.028182,1
4,Partnership Agreement,0.516078,0.027879,0.440784,0.032424,2
4,INTERNATIONAL,0.170196,0.06697,0.237647,0.008788,3
4,Connect globally. Thrive locally.,0.169804,0.08697,0.239216,0.01303,4
4,Toolkit,0.83098,0.072727,0.127059,0.025455,5
4,then place the partnership into Emeritus Status and will reflect this status in directories and all,0.117255,0.132424,0.751373,0.013333,6
4,lists of sister city programs.,0.118039,0.148788,0.218431,0.013333,7
4,"If a community wishes to terminate a sister city relationship, then a letter from the mayor or",0.118431,0.172424,0.732549,0.013333,8
4,highest elected official of the U.S. city should be sent to the mayor of the sister city. Sister,0.118039,0.188485,0.721569,0.013636,9
4,Cities International should be informed of this action in writing by the mayor of the U.S. city,0.118039,0.204848,0.72902,0.013333,10
4,and Sister Cities International will then remove the partnership from its directories and all lists,0.117647,0.221212,0.746275,0.013333,11
4,of sister city programs. We do not recommend terminating a relationship simply because it is,0.117647,0.237273,0.743529,0.013333,12
4,"dormant. Many partnerships wax and wane over the years, and in many cases a dormant",0.117647,0.253939,0.713333,0.013333,13
4,partnership may be reinvigorated by local members years after it has been inactive.,0.118039,0.269697,0.664314,0.013636,14
4,General Guidelines,0.118039,0.295152,0.231765,0.016061,15
4,In order for a sister city/county/state partnership to be recognized by Sister Cities International,0.118431,0.324242,0.754902,0.013636,16
4,"(SCI), the two communities must sign formal documents which clearly endorse the link. This",0.118039,0.340606,0.74,0.013636,17
4,presumes several key items: that the U.S. community is already a member of SCI and has,0.118039,0.35697,0.718039,0.013636,18
4,followed proper procedures (e.g. passed a city council resolution declaring the intent to twin,0.117255,0.373333,0.737647,0.013636,19
4,with the specific city); that both communities share a mutual commitment to the relationship;,0.117255,0.389394,0.740784,0.013636,20
4,and that both have secured the necessary support structure to build a lasting relationship. You,0.117647,0.405455,0.758039,0.013333,21
4,should check with your local sister city program to see if they have any additional requirements,0.117647,0.421818,0.760784,0.013636,22
4,before pursuing a sister city relationship.,0.118039,0.437879,0.323137,0.013636,23
4,"SCI often refers to these agreements as a ""Sister City Agreement"" or ""Memorandum of",0.118039,0.461515,0.696863,0.013939,24
4,"Understanding."" However, as the following examples show, the actual name and format of",0.118039,0.477576,0.729804,0.013636,25
4,your documents is left up to you.,0.117255,0.494242,0.262745,0.013636,26
4,A few things to keep in mind as you draft your agreement:,0.117255,0.517879,0.463137,0.013636,27
4,"Your agreement can range from the ceremonial, with language focusing on each city's",0.176471,0.542121,0.69098,0.013939,28
4,"commitment to fostering understanding, cooperation, and mutual benefit to the precise,",0.176471,0.558485,0.701961,0.013333,29
4,"with particular areas of interest, specific programs/activities, or more concrete goals",0.176078,0.574848,0.673725,0.013636,30
4,related to anything from numbers of exchanges to economic development.,0.176863,0.591212,0.596863,0.013636,31
4,"Don't try to include everything you plan to do. Some specifics, like particular areas of",0.177255,0.620303,0.681176,0.013939,32
4,"interest or participating institutions are good to include. However, there's no need to",0.176471,0.636667,0.675686,0.013636,33
4,include all the programs you plan to do if it makes the document too lengthy or limits,0.176863,0.652727,0.678824,0.013939,34
4,the scope of projects. This is a formal document to establish the relationship; specific,0.176078,0.668788,0.684706,0.013636,35
4,"tasks, responsibilities, or other nuts-and-bolts text related to implementation or",0.176078,0.685455,0.635686,0.013333,36
4,administration of the partnership can be expressed more fully in a separate,0.176471,0.701212,0.600392,0.013636,37
4,memorandum between the respective sister city committees. Your partnership,0.177255,0.717576,0.626667,0.013636,38
4,agreement is a historical document and should not be dated or limited by being aligned,0.176471,0.733636,0.699216,0.013636,39
4,with very specific tasks.,0.176078,0.750606,0.190196,0.013333,40
4,Work with your counterparts. Remember that this is signed by both cities. You should,0.176078,0.779697,0.68549,0.013636,41
4,share drafts of your agreement with your international partners and solicit feedback on,0.176471,0.795758,0.691765,0.013333,42
4,what they'd like to see in the agreement. Be flexible to cultural or municipal priorities.,0.176471,0.811818,0.679216,0.013939,43
4,Ask your counterparts to translate the agreement if it is drafted in English. It is,0.176078,0.841515,0.623137,0.013636,44
4,important for the citizens of your partner community to be able to read and understand,0.176863,0.857576,0.693725,0.013939,45
4,the commitment their city has made. Have someone in your own community who,0.176078,0.873939,0.649804,0.013636,46
5,SisterCities,0.169804,0.033333,0.239216,0.028182,1
5,Partnership Agreement,0.516078,0.027879,0.441176,0.032121,2
5,INTERNATIONAL,0.170196,0.06697,0.237255,0.008788,3
5,Connect globally. Thrive locally.,0.169804,0.08697,0.239216,0.01303,4
5,Toolkit,0.83098,0.07303,0.126667,0.025152,5
5,speaks that language check the foreign-language version to make sure it mirrors what,0.176471,0.132424,0.688235,0.013333,6
5,you have in your own agreement.,0.176471,0.148788,0.264706,0.013333,7
5,Keep it to one page. Ceremonial documents such as these partnership agreements,0.176863,0.178485,0.66549,0.013636,8
5,work best if they can be posted in their entirety.,0.176078,0.194545,0.380392,0.013636,9
5,Most sister city agreements include some acknowledgement of the founding principles,0.177255,0.224242,0.694902,0.013636,10
5,"of the sister city movement- to promote peace through mutual respect, understanding,",0.176471,0.240303,0.698431,0.013333,11
5,and cooperation.,0.176471,0.25697,0.13451,0.013333,12
5,Consider using official letterhead and/or other embellishments such as city seals or,0.176863,0.286061,0.665882,0.013333,13
5,logos to reflect your enhance the document. Sister city agreements are often posted at,0.176863,0.302121,0.695686,0.013636,14
5,city hall or other municipal offices and should reflect their historical importance,0.176471,0.318485,0.630588,0.013333,15
5,Look at other agreements your city has signed. These agreements may give you an idea,0.177255,0.347879,0.705098,0.013636,16
5,"of what is acceptable or possible, and they may be in an easily replicable format. If you",0.176471,0.364242,0.695686,0.013636,17
5,"cannot access older agreements please contact Sister Cities International, we may",0.176863,0.380303,0.663137,0.013636,18
5,"have them on file, although we do not have copies of all partnership agreements.",0.176863,0.396667,0.64549,0.013636,19
5,Documents must be signed by the top elected official of both communities.,0.177255,0.426364,0.601569,0.013333,20
5,"Check with your mayor, city council, town clerk, et al. to make sure that the agreement",0.176863,0.455758,0.694118,0.013636,21
5,"is OK with them. The mayor is the one putting his or her name on the paper, and you",0.176863,0.471818,0.677255,0.013333,22
5,don't want to spend time developing an agreement which will never be signed.,0.176863,0.488182,0.629412,0.013636,23
5,Official documents are usually signed during a formal ceremony recognizing the,0.176863,0.517576,0.638431,0.013636,24
5,partnership. Be sure both communities receive a signed set of the official documents,0.177255,0.533939,0.683922,0.013636,25
5,for their records.,0.176078,0.550606,0.131373,0.010606,26
5,Remember to send your signed agreement to Sister Cities International. After we,0.177255,0.579697,0.645098,0.013636,27
5,receive your agreement we will post the relationship in the City Directory and make sure,0.176863,0.595758,0.703137,0.013636,28
5,it is included in our Annual Membership Directory.,0.176863,0.612121,0.398039,0.013333,29
5,Remember that each city's sister city program is independent and can impose requirements,0.118431,0.640606,0.736471,0.013939,30
5,"like the establishment of a committee, a review period, sustainability/funding plan, among",0.118039,0.65697,0.715686,0.013636,31
5,"others, before sanctioning a sister city agreement. Check with your local program or mayor's",0.117647,0.672727,0.743529,0.014242,32
5,office to see if this is the case.,0.117647,0.689091,0.241176,0.011515,33
5,On the following pages you'll find a series of partnership agreements to give you an idea of,0.118039,0.717879,0.728627,0.013939,34
5,"what is possible. While you should feel free to use some of the formatting and language, we",0.117255,0.734242,0.73451,0.013636,35
5,encourage you to make your agreement your own and be creative with what you produce. If,0.117647,0.750606,0.737647,0.013636,36
5,you are unsure about your agreement or want advice you can always solicit feedback by,0.117647,0.766667,0.708627,0.013636,37
5,sending it to our Membership Director at akaplan@sister-cities.org or contacting us at (202),0.117647,0.782727,0.732157,0.013636,38
5,347-8630.,0.117647,0.799394,0.080392,0.010303,39
6,SisterCities,0.169412,0.033333,0.239608,0.028485,1
6,Partnership Agreement,0.516471,0.027879,0.440784,0.032727,2
6,INTERNATIONAL,0.170196,0.066667,0.238431,0.009091,3
6,Connect globally. Thrive locally.,0.169412,0.08697,0.239608,0.013333,4
6,Toolkit,0.830588,0.072727,0.127843,0.025758,5
6,"jull bubzig 2000 3,312",0.378039,0.291212,0.32549,0.019394,6
6,ABU DHABI MUNICIPALITY & TOWN PLANNING,0.376471,0.316667,0.327451,0.016667,7
6,AN AGREEMENT FOR THE ESTABLISHMENT OF,0.260784,0.373636,0.52549,0.012727,8
6,SISTER CITIES RELATIONSHIP,0.337647,0.393636,0.342745,0.012121,9
6,BETWEEN,0.454902,0.413636,0.110588,0.011212,10
6,THE CITY OF ABU DHABI ( U. A.E),0.337255,0.432727,0.375686,0.013939,11
6,AND,0.487843,0.452727,0.048235,0.011212,12
6,"HOUSTON, TEXAS ( U.S.A)",0.385882,0.471515,0.298039,0.014848,13
6,"The Sister City Program, administered by Sister Cities International, was initiated",0.221961,0.525455,0.597255,0.01303,14
6,By the President of the United States of America in 1956 to encourage greater,0.222745,0.539394,0.561961,0.012727,15
6,Friendship and understanding between the United States and other nations through,0.222745,0.553333,0.608235,0.012727,16
6,Direct personal contact: and,0.222745,0.567576,0.20549,0.012424,17
6,"In order to foster those goals, the people of Abu Dhabi and Houston, in a gesture of",0.222353,0.594242,0.603529,0.012424,18
6,"Friendship and goodwill, agree to collaborate for the mutual benefit of their",0.222745,0.608182,0.547843,0.01303,19
6,"Communities by exploring education, economic and cultural opportunities.",0.222353,0.622121,0.541961,0.012121,20
6,"Abu Dhabi and Houston, sharing a common interest in energy, technology and",0.221569,0.648788,0.574118,0.012424,21
6,"medicine, and the desire to promote mutual understanding among our citizens do",0.222353,0.66303,0.588235,0.012121,22
6,"hereby proclaim themselves Sister Cities beginning on the 13th day of March 2001,",0.221961,0.673636,0.594118,0.015758,23
6,the date of Houston City Council resolution estatblishing the Sister City,0.221961,0.690303,0.519608,0.01303,24
6,relationship became effective.,0.221569,0.705152,0.217647,0.012424,25
6,"Signed on this 26 of October 2002, in duplicate in the Arabic and English",0.221569,0.732121,0.533333,0.01303,26
6,"Languages, both text being equally authentic.",0.221961,0.746667,0.328627,0.012727,27
6,A,0.344314,0.768485,0.084706,0.030303,28
6,Sheikh Mohammed bin Butti AI Hamed,0.245882,0.806364,0.366275,0.010909,29
6,Lee P.Brown,0.729412,0.806364,0.118824,0.010303,30
6,Chairman of Abu Dhabi Municipality,0.24549,0.823636,0.342353,0.012727,31
6,Mayor of Houston,0.704706,0.823333,0.166667,0.012424,32
6,&Town Planning,0.324314,0.841212,0.155686,0.012424,33
7,SisterCities,0.169412,0.033333,0.239608,0.028485,1
7,Partnership Agreement,0.516078,0.027879,0.441176,0.032424,2
7,INTERNATIONAL,0.17098,0.066667,0.237255,0.009091,3
7,Connect globally. Thrive locally.,0.169412,0.08697,0.239216,0.013333,4
7,Toolkit,0.83098,0.072727,0.127059,0.025758,5
7,THE CITY OF NEW YORK,0.438824,0.262121,0.240784,0.009697,6
7,OFFICE OF THE MAYOR,0.450196,0.27697,0.220392,0.009697,7
7,"NEW YORK, N.Y. 10007",0.461176,0.29303,0.196863,0.010303,8
7,THE NEW YORK CITY-LONDON SISTER CITY PARTNERSHIP,0.267451,0.355758,0.582745,0.011818,9
7,Memorandum of Understanding,0.420392,0.371212,0.274902,0.013333,10
7,The Sister City partnership between New York City and London will foster mutually,0.201176,0.402121,0.674118,0.014242,11
7,beneficial solutions to common challenges for these two great cosmopolitan entities.,0.201176,0.417273,0.66902,0.013636,12
7,"Consequently, the Sister City relationship between the two will be one of the most",0.201176,0.432727,0.652549,0.015152,13
7,"important in their network of global partnerships, as it strives to:",0.201176,0.448182,0.50902,0.015455,14
7,Encourage and publicize existing exchanges between London and New York City so,0.230588,0.480303,0.671373,0.015152,15
7,that they can flourish to benefit a wider cross-section of the citizens of both;,0.230588,0.496061,0.602353,0.015152,16
7,"Support and promote the development of new social, economic, academic and",0.230196,0.512424,0.618431,0.015455,17
7,community programs to encourage both cities' citizens to share their experiences as a,0.229804,0.527879,0.678039,0.014848,18
